{"recordType":"documentary-extraction","protocolVersion":"1.5","source":{"recordId":"book-31-psalm-203","canonicalPath":"data/corpus/books/book-31/psalm-203.json","psalmNumber":203,"book":{"number":31,"title":"La nouvelle Pâque"},"archangel":"raphael"},"extractionValidation":{"status":"draft"},"subjects":[{"localId":"subject-001","localSubject":"Esséniens","status":"EXPLOITÉ","verseNumbers":[1],"evidence":[{"verseNumbers":[1],"quote":"les Esséniens sont essentiellement des prêtres et des thérapeutes."}],"documentaryNote":"Les Esséniens sont définis par une vocation sacerdotale et thérapeutique, au service du divin et de la guérison des mondes."},{"localId":"subject-002","localSubject":"alliance","status":"EXPLOITÉ","verseNumbers":[1],"evidence":[{"verseNumbers":[1],"quote":"Vous êtes les gardiens de l’alliance et de la religion du Père."}],"documentaryNote":"L’alliance est confiée à la garde des Esséniens avec la religion du Père."},{"localId":"subject-003","localSubject":"religion du Père","status":"EXPLOITÉ","verseNumbers":[1],"evidence":[{"verseNumbers":[1],"quote":"Vous êtes les gardiens de l’alliance et de la religion du Père."}],"documentaryNote":"La religion du Père doit être gardée et servie par les Esséniens."},{"localId":"subject-004","localSubject":"guérison","status":"EXPLOITÉ","verseNumbers":[3],"evidence":[{"verseNumbers":[3],"quote":"Vous devez être des guérisseurs des mondes."}],"documentaryNote":"La guérison est une fonction essénienne tournée vers les êtres et les mondes, et elle suppose d’abord un travail de guérison sur soi."},{"localId":"subject-005","localSubject":"santé","status":"EXPLOITÉ","verseNumbers":[2],"evidence":[{"verseNumbers":[2],"quote":"Je vous parle de la véritable santé et de la vraie thérapie."}],"documentaryNote":"Le texte distingue la véritable santé des méthodes illusoires du monde des hommes."},{"localId":"subject-006","localSubject":"âme","status":"EXPLOITÉ","verseNumbers":[4],"evidence":[{"verseNumbers":[4],"quote":"vous devez guérir l’âme"}],"documentaryNote":"L’âme fait partie des réalités que la vie du guérisseur doit restaurer et conduire vers l’accord juste."},{"localId":"subject-007","localSubject":"conscience","status":"EXPLOITÉ","verseNumbers":[4],"evidence":[{"verseNumbers":[4],"quote":"reconnecter la conscience aux mondes subtils, au sacré"}],"documentaryNote":"La conscience doit être reconnectée aux mondes subtils et au sacré."},{"localId":"subject-008","localSubject":"mondes subtils","status":"EXPLOITÉ","verseNumbers":[4],"evidence":[{"verseNumbers":[4],"quote":"reconnecter la conscience aux mondes subtils, au sacré"}],"documentaryNote":"Les mondes subtils sont un domaine auquel la conscience doit être reliée et avec lequel l’homme doit respirer."},{"localId":"subject-009","localSubject":"immortalité","status":"EXPLOITÉ","verseNumbers":[4],"evidence":[{"verseNumbers":[4],"quote":"donner à l’acte une valeur, un sens qui conduisent à l’immortalité."}],"documentaryNote":"L’immortalité apparaît comme une orientation à laquelle les actes doivent être reliés."},{"localId":"subject-010","localSubject":"médecin","status":"EXPLOITÉ","verseNumbers":[5],"evidence":[{"verseNumbers":[5],"quote":"Un médecin est un être qui aspire à être éduqué"}],"documentaryNote":"Le médecin doit être éduqué, connaître les lois, conseiller sans condamner et ouvrir un chemin de guérison."},{"localId":"subject-011","localSubject":"lois","status":"EXPLOITÉ","verseNumbers":[5],"evidence":[{"verseNumbers":[5],"quote":"Il doit donc connaître les lois afin de savoir comment poser une écriture pour rétablir l’ordre."}],"documentaryNote":"La connaissance des lois permet au médecin de poser une écriture qui rétablit l’ordre."},{"localId":"subject-012","localSubject":"libération","status":"EXPLOITÉ","verseNumbers":[6],"evidence":[{"verseNumbers":[6],"quote":"il partagera avec lui l’idée d’un chemin de libération"}],"documentaryNote":"Le chemin de libération appartient à l’accompagnement thérapeutique et vise la reconstruction et la guérison."},{"localId":"subject-013","localSubject":"Dieu","status":"EXPLOITÉ","verseNumbers":[6],"evidence":[{"verseNumbers":[6],"quote":"la guérison ultime étant l’accord parfait avec Dieu dans tous les aspects de l’être."}],"documentaryNote":"La guérison ultime est définie comme un accord parfait avec Dieu dans tous les aspects de l’être."},{"localId":"subject-014","localSubject":"art de guérir","status":"EXPLOITÉ","verseNumbers":[7],"evidence":[{"verseNumbers":[7],"quote":"L’art de guérir est lié au chemin initiatique et à la religion divine."}],"documentaryNote":"L’art de guérir doit être étudié et pratiqué ; il est relié au chemin initiatique et à la religion divine."},{"localId":"subject-015","localSubject":"nature vivante","status":"EXPLOITÉ","verseNumbers":[8],"evidence":[{"verseNumbers":[8],"quote":"Vivez en harmonie avec la nature vivante et étudiez sa sagesse."}],"documentaryNote":"La nature vivante doit être vécue dans l’harmonie et étudiée dans sa sagesse."},{"localId":"subject-016","localSubject":"fonction de l’homme","status":"EXPLOITÉ","verseNumbers":[11],"evidence":[{"verseNumbers":[11],"quote":"La fonction de l’homme est d’unir les mondes et de faire circuler l’énergie dans la pureté."}],"documentaryNote":"La fonction de l’homme est d’unir les mondes et de faire circuler l’énergie dans la pureté."},{"localId":"subject-017","localSubject":"intelligence divine","status":"EXPLOITÉ","verseNumbers":[11],"evidence":[{"verseNumbers":[11],"quote":"conformes à l’intelligence divine"}],"documentaryNote":"L’homme doit chercher et incarner des idées et forces d’âme conformes à l’intelligence divine."},{"localId":"subject-018","localSubject":"savoir et pouvoir","status":"EXPLOITÉ","verseNumbers":[12],"evidence":[{"verseNumbers":[12],"quote":"le savoir amène le pouvoir."}],"documentaryNote":"Le savoir engendre un pouvoir qui doit être dirigé dans l’amour et la guérison, faute de quoi il produit désordre et maladie."},{"localId":"subject-019","localSubject":"tradition de la Lumière","status":"EXPLOITÉ","verseNumbers":[13],"evidence":[{"verseNumbers":[13],"quote":"les associer de nouveau avec la tradition de la Lumière et la grande religion de Dieu."}],"documentaryNote":"Le vocabulaire thérapeutique doit être rendu à la tradition de la Lumière et à la religion de Dieu."},{"localId":"subject-020","localSubject":"maison de Dieu","status":"EXPLOITÉ","verseNumbers":[14],"evidence":[{"verseNumbers":[14],"quote":"La maison de Dieu doit être un haut lieu de guérison."}],"documentaryNote":"La maison de Dieu est appelée à devenir un haut lieu de guérison."},{"localId":"subject-021","localSubject":"mal","status":"EXPLOITÉ","verseNumbers":[16],"evidence":[{"verseNumbers":[16],"quote":"Connaissez-le, mais ne soyez jamais à son service."}],"documentaryNote":"Le mal doit être connu sans être servi ; l’homme doit s’en immuniser."},{"localId":"subject-022","localSubject":"bien","status":"EXPLOITÉ","verseNumbers":[19],"evidence":[{"verseNumbers":[19],"quote":"Multipliez le bien en convertissant les êtres à la religion du Dieu de l’amour, de la sagesse et de la grande bonté."}],"documentaryNote":"Le bien doit être multiplié et rayonné autour de soi."},{"localId":"subject-023","localSubject":"Ronde des Archanges","status":"EXPLOITÉ","verseNumbers":[29],"evidence":[{"verseNumbers":[29],"quote":"Tu dois participer à la Ronde des Archanges"}],"documentaryNote":"La participation à la Ronde des Archanges fait partie des moyens donnés pour se nourrir des mondes supérieurs."},{"localId":"subject-024","localSubject":"Église Essénienne","status":"EXPLOITÉ","verseNumbers":[29],"evidence":[{"verseNumbers":[29],"quote":"soutenir l’Église Essénienne d’une façon ou d’une autre."}],"documentaryNote":"L’Église Essénienne doit être soutenue dans le cadre du chemin de guérison et de formation."},{"localId":"subject-025","localSubject":"étude","status":"EXPLOITÉ","verseNumbers":[30],"evidence":[{"verseNumbers":[30],"quote":"L’étude doit se faire notamment à travers les psaumes des Évangiles esséniens."}],"documentaryNote":"L’étude des psaumes constitue un corps subtil et développe le discernement."},{"localId":"subject-026","localSubject":"discernement","status":"EXPLOITÉ","verseNumbers":[30],"evidence":[{"verseNumbers":[30],"quote":"va engendrer un discernement de plus en plus clair."}],"documentaryNote":"Le discernement se clarifie par l’étude qui construit un corps plus subtil."},{"localId":"subject-027","localSubject":"esprit de guérison","status":"EXPLOITÉ","verseNumbers":[32],"evidence":[{"verseNumbers":[32],"quote":"Tu dois invoquer l’esprit de guérison en toi et autour de toi."}],"documentaryNote":"L’esprit de guérison doit être invoqué intérieurement et autour de soi."},{"localId":"subject-028","localSubject":"maladie","status":"EXPLOITÉ","verseNumbers":[33],"evidence":[{"verseNumbers":[33],"quote":"Si tu portes en toi la maladie, tu en feras porter le poids sur les autres"}],"documentaryNote":"La maladie portée intérieurement se transmet aux autres et les enferme ; elle doit donc être reconnue et guérie."},{"localId":"subject-029","localSubject":"mondes supérieurs","status":"EXPLOITÉ","verseNumbers":[34],"evidence":[{"verseNumbers":[34],"quote":"Les mondes supérieurs se servent de ce critère pour jauger l’homme"}],"documentaryNote":"Les mondes supérieurs évaluent l’homme selon le critère de libération ou d’enfermement."},{"localId":"subject-030","localSubject":"liberté","status":"EXPLOITÉ","verseNumbers":[34],"evidence":[{"verseNumbers":[34],"quote":"celui qui libère est libre, celui qui enferme est luimême prisonnier."}],"documentaryNote":"La liberté est reconnue à la capacité de libérer plutôt qu’à enfermer."}],"titleOnlyMatters":[]}