{"recordType":"documentary-extraction","protocolVersion":"1.5","source":{"recordId":"book-44-psalm-279","canonicalPath":"data/corpus/books/book-44/psalm-279.json","psalmNumber":279,"book":{"number":44,"title":"L’énergie de l’argent"},"archangel":"ouriel"},"extractionValidation":{"status":"draft"},"subjects":[{"localId":"subject-001","localSubject":"argent comme énergie créatrice universelle et serviteur de Dieu dont la nature propre est générosité, partage, circulation, expansion et accomplissement","status":"EXPLOITÉ","verseNumbers":[3,4,5,6,8,9,10,17,18,21,22,23,25,26,47,49,50,51,58],"evidence":[{"verseNumbers":[5],"quote":"L’argent aime Dieu et veut uniquement être à son service. Il est la matérialisation d’une énergie créatrice universelle"}],"documentaryNote":"Richesse, circulation, générosité, moyen et force créatrice sont les attributs et fonctions coordonnés de l’être de l’argent dans ce psaume."},{"localId":"subject-002","localSubject":"usurpation et dénaturation de l’argent comme mécanisme d’asservissement intérieur qui transforme son énergie en avidité, peur, intérêt et identification au mortel","status":"EXPLOITÉ","verseNumbers":[4,5,6,7,10,11,12,13,16,19,20,23,24,30,33,45,46,47,53],"evidence":[{"verseNumbers":[13],"quote":"cette énergie éveille maintenant des mondes intérieurs qui sont opposés à la richesse, la beauté, la générosité, le partage"}],"documentaryNote":"Tyrannie, concepts, consommation, panique, avidité, esclavage et illusion d’avoir sont les manifestations et conséquences d’une même dénaturation."},{"localId":"subject-003","localSubject":"libération de l’argent comme responsabilité consciente de l’observer, le bénir et le reconduire vers Dieu afin qu’il redevienne force de construction et d’expansion","status":"EXPLOITÉ","verseNumbers":[7,11,12,14,15,17,18,20,25,26,31,32,46,47,52,53],"evidence":[{"verseNumbers":[17],"quote":"bénir l’argent, d’en prendre soin et de le libérer en lui permettant d’être au service de Dieu"}],"documentaryNote":"Observation de soi, parole d’Ouriel, oui/non, juste compréhension et orientation vers la Lumière sont les moyens coordonnés de cette responsabilité opératoire."},{"localId":"subject-004","localSubject":"bonheur et paix comme états d’être intérieurs divins qui ne peuvent être produits par l’acquisition extérieure mais doivent être portés pour se manifester dans le monde","status":"EXPLOITÉ","verseNumbers":[27,28,29,30,31,33,34,35,36,37,39,40,41,42,44,51],"evidence":[{"verseNumbers":[34],"quote":"Le bonheur, la paix sont des états d’être et ne peuvent être le résultat d’acquisitions extérieures."}],"documentaryNote":"Besoins, simplicité, vérité et opposition paix/guerre restent sous la distinction entre état intérieur et avoir extérieur."},{"localId":"subject-005","localSubject":"aucun gaspillage et juste économie comme art de vivre appliqué à toutes les forces, organes et œuvres afin de respecter l’énergie créatrice divine","status":"EXPLOITÉ","verseNumbers":[54,55,56,57,58],"evidence":[{"verseNumbers":[56],"quote":"Rien ne doit être gaspillé dans aucun monde, ni dans l’intelligence, la conscience, les pensées, les sentiments, la volonté et les œuvres."}],"documentaryNote":"Cette séquence finale survit comme règle opératoire générale explicitement posée comme fondation de la Nation ; la liste des organes n’est pas atomisée."}],"titleOnlyMatters":[]}