{"recordType":"documentary-extraction","protocolVersion":"1.5","source":{"recordId":"book-37-psalm-249","canonicalPath":"data/corpus/books/book-37/psalm-249.json","psalmNumber":249,"book":{"number":37,"title":"La maîtrise du serpent"},"archangel":"michael"},"extractionValidation":{"status":"draft"},"subjects":[{"localId":"subject-001","localSubject":"initiation comme étape de progression et nouvelle façon d’être","status":"EXPLOITÉ","verseNumbers":[1,2,11,12,13,14,15,19,25],"evidence":[{"verseNumbers":[1],"quote":"des portes permettant d’entrer dans un nouvel aspect de la vie"}],"documentaryNote":"L’initiation est une étape structurante qui ouvre une perception, une conscience, une maîtrise et une manière d’être nouvelles ; les âges et consécrations en sont des modalités, non des matières séparées."},{"localId":"subject-002","localSubject":"préparation à l’initiation","status":"EXPLOITÉ","verseNumbers":[3,4,5,6,9,13,20,31,36],"evidence":[{"verseNumbers":[3],"quote":"ce n’est pas le passage de l’initiation en lui-même qui est le plus important, mais la préparation"}],"documentaryNote":"La qualité de l’initiation dépend d’une préparation consciente, vraie et pure qui rend l’homme capable d’accueillir et de porter ce qui lui est transmis."},{"localId":"subject-003","localSubject":"initiation vécue et portée dans la vie","status":"EXPLOITÉ","verseNumbers":[14,15,16,19,20,21,22,23,25,37,39,40],"evidence":[{"verseNumbers":[25],"quote":"recevoir une initiation et la porter dans sa vie"}],"documentaryNote":"Recevoir ne suffit pas : la semence initiatique doit être alimentée, actualisée et incarnée jusqu’à devenir conscience, corps, mode de vie et actes concrets."},{"localId":"subject-004","localSubject":"grade extérieur, apparence et superstition","status":"EXPLOITÉ","verseNumbers":[9,11,21,24,29,31,36,38,39],"evidence":[{"verseNumbers":[11],"quote":"il ne s’agit pas d’obtenir un grade extérieur"}],"documentaryNote":"Le texte oppose l’initiation réelle aux titres, apparences, congratulation et superstition qui ne prouvent aucune transformation intérieure."},{"localId":"subject-005","localSubject":"responsabilité envers Dieu et les générations futures","status":"EXPLOITÉ","verseNumbers":[7,8,16,17,18,25,37,38,40],"evidence":[{"verseNumbers":[37],"quote":"C’est une responsabilité et un engagement vis-àvis de soi-même et des mondes supérieurs"}],"documentaryNote":"L’initiation engage l’homme envers Dieu, les mondes supérieurs et la transmission aux générations futures ; elle doit être valorisée par la fidélité et les actes."},{"localId":"subject-006","localSubject":"actualisation permanente de la Lumière et du lien supérieur","status":"EXPLOITÉ","verseNumbers":[22,23,24,25,30,33,37],"evidence":[{"verseNumbers":[22],"quote":"actualiser la Lumière et le lien avec les mondes supérieurs en permanence"}],"documentaryNote":"Le lien initiatique demeure vivant par une activité continue qui nourrit la Lumière et empêche que l’opportunité reçue ne s’éteigne."},{"localId":"subject-007","localSubject":"sagesse comme fruit et perfection de l’initiation","status":"EXPLOITÉ","verseNumbers":[26,27,28,30,33,35,39,40],"evidence":[{"verseNumbers":[26],"quote":"une telle initiation conduit à la perfection, c’est-à-dire à la sagesse"}],"documentaryNote":"L’aboutissement initiatique est une sagesse incarnée qui produit un fruit transmissible et non la revendication d’un niveau personnel."},{"localId":"subject-008","localSubject":"Ronde des Archanges comme initiation majeure et corps de Lumière","status":"EXPLOITÉ","verseNumbers":[33,34,35,36,37],"evidence":[{"verseNumbers":[34],"quote":"la plus grande initiation aujourd’hui sur terre est la Ronde des Archanges"}],"documentaryNote":"La Ronde des Archanges est présentée comme l’initiation majeure, incorporation de la Lumière et grand corps nourrissant quotidiennement les corps de l’initié."},{"localId":"subject-009","localSubject":"maîtrise du serpent comme manifestation de l’initiation","status":"EXPLOITÉ","verseNumbers":[39,40],"evidence":[{"verseNumbers":[39],"quote":"une maîtrise de la vie qui grandit, c’est-à-dire le contrôle du serpent"}],"documentaryNote":"La maîtrise croissante du serpent constitue une manifestation concrète de l’initiation incarnée, distincte du simple statut initiatique."}],"titleOnlyMatters":[]}