{"recordType":"documentary-extraction","protocolVersion":"1.5","source":{"recordId":"book-42-psalm-284","canonicalPath":"data/corpus/books/book-42/psalm-284.json","psalmNumber":284,"book":{"number":42,"title":"L’état ultime de la paix"},"archangel":"gabriel"},"extractionValidation":{"status":"draft"},"subjects":[{"localId":"subject-001","localSubject":"individualisation consciente comme naissance d’un rayon créateur capable de choisir ses alliances et d’écrire son futur","status":"EXPLOITÉ","verseNumbers":[1,2,3,4,5,6,8,11,12,14],"evidence":[{"verseNumbers":[5],"quote":"Lorsqu’un homme s’individualise, il devient un rayon créateur"}],"documentaryNote":"Union, lignée, transmission et choix d’affinités restent les conséquences et formes d’une individualité devenue créatrice."},{"localId":"subject-002","localSubject":"engagement parental dans le culte de la Lumière comme alliance consciente ouvrant le chemin de l’immortalité","status":"EXPLOITÉ","verseNumbers":[6,7,8,9,10,11,12,13,14,21,22,23,25],"evidence":[{"verseNumbers":[9],"quote":"vous avez ouvert le chemin de l’immortalité consciente"}],"documentaryNote":"Choix conscient, pureté de l’intention, mémoire, écriture et absence de retour sont les dimensions de cette alliance immortelle."},{"localId":"subject-003","localSubject":"corps comme disciple qui se transforme et s’accorde progressivement à l’orientation de la vie intérieure","status":"EXPLOITÉ","verseNumbers":[15,16,17,18,20],"evidence":[{"verseNumbers":[15],"quote":"Le corps est essentiellement un disciple de l’homme."}],"documentaryNote":"Adaptation, respiration, fréquence, transparence et abandon des anciennes nourritures sont les modalités de la transformation corporelle."},{"localId":"subject-004","localSubject":"pratique du culte comme désaffiliation progressive du monde de l’homme et unification avec l’âme immortelle","status":"EXPLOITÉ","verseNumbers":[16,17,18,19,20,21,22,24],"evidence":[{"verseNumbers":[18],"quote":"par la pratique du culte de Dieu la Lumière, ces mondes vont vous quitter"}],"documentaryNote":"Détachement, autre nourriture, nouveaux sens, observation du monde extérieur et maîtrise de la dépendance sont les effets coordonnés de la pratique."},{"localId":"subject-005","localSubject":"entretien des influences ténébreuses comme dilapidation du capital de l’engagement et obstacle à la libération","status":"EXPLOITÉ","verseNumbers":[17,19,24],"evidence":[{"verseNumbers":[24],"quote":"Ce monde dilapidera le capital de votre engagement"}],"documentaryNote":"Doute, peur, avidité, querelle et méchanceté ne sont pas atomisés ; ils constituent les modalités d’une emprise qui compromet la finalité de l’alliance."}],"titleOnlyMatters":[]}