{"recordType":"documentary-extraction","protocolVersion":"1.5","source":{"recordId":"book-31-psalm-192","canonicalPath":"data/corpus/books/book-31/psalm-192.json","psalmNumber":192,"book":{"number":31,"title":"La nouvelle Pâque"},"archangel":"raphael"},"extractionValidation":{"status":"draft"},"subjects":[{"localId":"subject-001","localSubject":"Église Essénienne Chrétienne","status":"EXPLOITÉ","verseNumbers":[3,4,8,9,15,18],"evidence":[{"verseNumbers":[8],"quote":"Que l’Église Essénienne s’incarne dans un corps de plus en plus stable et parfaitement organisé et structuré afin qu’elle puisse ouvrir les portes et montrer un chemin à toutes les âmes qui cherchent à rencontrer Dieu."}],"documentaryNote":"L’Église Essénienne Chrétienne est présentée comme une église pour Dieu, appelée à s’incarner dans un corps stable, organisé et structuré, à ouvrir un chemin aux âmes et à devenir un corps pour l’Ange de la guérison."},{"localId":"subject-002","localSubject":"Ange de la guérison","status":"EXPLOITÉ","verseNumbers":[4,18],"evidence":[{"verseNumbers":[4],"quote":"J’offre à cette église le don de l’Ange de la guérison."}],"documentaryNote":"L’Ange de la guérison est offert à l’Église et doit trouver un corps à travers l’Église Essénienne Chrétienne."},{"localId":"subject-003","localSubject":"guérison","status":"EXPLOITÉ","verseNumbers":[4,6,14,18],"evidence":[{"verseNumbers":[6],"quote":"Alors, si vous ne laissez aucun monde perturbateur s’infiltrer et apporter le côté sombre, vous recevrez l’acte de guérison et vous serez délivrés de certaines influences qui pèsent sur votre vie et vous alourdissent."}],"documentaryNote":"La guérison est reliée à une préparation du corps, à la maîtrise des influences et au maintien d’un monde calme et harmonieux ; elle délivre de certaines influences qui alourdissent la vie."},{"localId":"subject-004","localSubject":"cercle sacré","status":"EXPLOITÉ","verseNumbers":[2],"evidence":[{"verseNumbers":[2],"quote":"Je vous remercie d’avoir formé le cercle sacré pour que je puisse être présent sur la terre afin d’y apporter un nouveau souffle et une autre respiration."}],"documentaryNote":"Le cercle sacré est présenté comme ce qui permet la présence de Raphaël sur la terre et l’apport d’un nouveau souffle et d’une autre respiration."},{"localId":"subject-005","localSubject":"bénédiction","status":"EXPLOITÉ","verseNumbers":[1,3,7,10],"evidence":[{"verseNumbers":[7],"quote":"Recevez la bénédiction pour devenir plus forts afin de faire grandir la nation et l’église de Dieu sur toute la terre."}],"documentaryNote":"La bénédiction est donnée comme force, cadeau et gratitude ; elle doit rendre les Esséniens plus forts pour faire grandir la nation et l’église de Dieu."},{"localId":"subject-006","localSubject":"Esséniens","status":"EXPLOITÉ","verseNumbers":[7,9,11,12,17],"evidence":[{"verseNumbers":[7],"quote":"Recevez cela en hommage au fait que vous êtes des Esséniens."}],"documentaryNote":"Les Esséniens reçoivent une bénédiction et sont appelés à servir de chemin et d’intermédiaire pour les âmes, à vivre comme une famille d’âmes vivantes et à soutenir l’œuvre."},{"localId":"subject-007","localSubject":"âmes","status":"EXPLOITÉ","verseNumbers":[8,9,11,12],"evidence":[{"verseNumbers":[9],"quote":"Soyez conscients que vous ouvrez un chemin et que par votre intermédiaire, les âmes qui ont soif d’un monde supérieur et d’une vie belle pourront trouver, au sein de l’Église Essénienne Chrétienne, un soulagement et un soutien."}],"documentaryNote":"Les âmes qui cherchent Dieu et ont soif d’un monde supérieur et d’une vie belle doivent pouvoir trouver dans l’Église un chemin, un soulagement et un soutien ; les Esséniens sont appelés à être une famille d’âmes vivantes."},{"localId":"subject-008","localSubject":"pensées","status":"EXPLOITÉ","verseNumbers":[6,12,13,17],"evidence":[{"verseNumbers":[12],"quote":"Naturellement, les hommes nourrissent des mauvaises pensées."}],"documentaryNote":"Les pensées peuvent être belles ou mauvaises, alourdir la vie lorsqu’elles sont récupérées inconsciemment, et doivent être maîtrisées et élevées vers davantage de grandeur et de subtilité."},{"localId":"subject-009","localSubject":"influences","status":"EXPLOITÉ","verseNumbers":[6,13,14],"evidence":[{"verseNumbers":[14],"quote":"Alors je vous entourerai de l’esprit de la guérison, je vous protègerai et vous soulagerai des souffrances inutiles, de ce qui alourdit votre vie, vous rend confus et vous conduit dans les ténèbres."}],"documentaryNote":"Des influences peuvent peser sur la vie, entrer et sortir de l’être et conduire à la confusion et aux ténèbres ; le psaume enseigne à les maîtriser et promet protection et soulagement."},{"localId":"subject-010","localSubject":"culte de l’air","status":"EXPLOITÉ","verseNumbers":[12,14],"evidence":[{"verseNumbers":[12],"quote":"Lorsque le culte de l’air est célébré sur les terres esséniennes, ces pensées retombent sur la terre comme des déchets afin d’en libérer le ciel."}],"documentaryNote":"Le culte de l’air est présenté comme agissant sur les mauvaises pensées en les faisant retomber sur la terre afin de libérer le ciel ; ceux qui le célèbrent doivent respecter les lois enseignées."},{"localId":"subject-011","localSubject":"maîtrise des pensées, des états d’âme et des influences","status":"EXPLOITÉ","verseNumbers":[13],"evidence":[{"verseNumbers":[13],"quote":"Apprenez donc à être dans la maîtrise de vos pensées, de vos états d’âme, des influences qui entrent et sortent de vous."}],"documentaryNote":"Le psaume prescrit explicitement la maîtrise des pensées, des états d’âme et des influences qui entrent et sortent de l’être, en la reliant à la légèreté, à la clarté et à l’amélioration de la vie."},{"localId":"subject-012","localSubject":"conscience de groupe","status":"EXPLOITÉ","verseNumbers":[11],"evidence":[{"verseNumbers":[11],"quote":"Prenez soin les uns des autres, développez une conscience de groupe, un esprit d’équipe, de soutien mutuel et de respect."}],"documentaryNote":"La conscience de groupe doit être développée avec l’esprit d’équipe, le soutien mutuel et le respect ; elle appartient à une nécessité de vie commune entre âmes."},{"localId":"subject-013","localSubject":"soutien mutuel","status":"EXPLOITÉ","verseNumbers":[9,11,17],"evidence":[{"verseNumbers":[11],"quote":"Prenez soin les uns des autres, développez une conscience de groupe, un esprit d’équipe, de soutien mutuel et de respect."}],"documentaryNote":"Le soutien mutuel est demandé comme forme concrète du soin réciproque, de l’esprit d’équipe et de la vie commune ; il inclut l’encouragement mutuel et le soutien au guide."},{"localId":"subject-014","localSubject":"respect","status":"EXPLOITÉ","verseNumbers":[11],"evidence":[{"verseNumbers":[11],"quote":"Prenez soin les uns des autres, développez une conscience de groupe, un esprit d’équipe, de soutien mutuel et de respect."}],"documentaryNote":"Le respect est explicitement demandé comme composante nécessaire de la conscience de groupe et du soin réciproque."},{"localId":"subject-015","localSubject":"amour","status":"EXPLOITÉ","verseNumbers":[1,15],"evidence":[{"verseNumbers":[15],"quote":"Ne soyez jamais les uns contre les autres, mais unissez-vous dans l’amour et formez un corps concret à cette église par vos corps et votre vie."}],"documentaryNote":"L’amour est présenté comme le principe d’union opposé à l’affrontement mutuel et comme composante de l’alliance soutenue par les participants à la fête."},{"localId":"subject-016","localSubject":"intelligence collective","status":"EXPLOITÉ","verseNumbers":[16],"evidence":[{"verseNumbers":[16],"quote":"Assemblez-vous, partagez vos moyens, soyez actifs pour faire apparaître une intelligence collective qui permettra l’émergence d’une nouvelle façon d’être au monde."}],"documentaryNote":"L’intelligence collective doit apparaître par l’assemblée, le partage des moyens et l’activité commune ; elle doit permettre l’émergence d’une nouvelle façon d’être au monde."},{"localId":"subject-017","localSubject":"Bien commun","status":"EXPLOITÉ","verseNumbers":[17],"evidence":[{"verseNumbers":[17],"quote":"Comprenez que c’est là le Bien commun."}],"documentaryNote":"Le Bien commun est identifié au soutien du guide, à la réalisation de l’œuvre et à l’établissement autour de lui d’une respiration vivante et de pensées plus grandes et subtiles."},{"localId":"subject-018","localSubject":"corps","status":"EXPLOITÉ","verseNumbers":[6,15,18],"evidence":[{"verseNumbers":[6],"quote":"Durant les 7 jours qui vont suivre ma célébration, préparez votre corps par de belles pensées et des actes posés."}],"documentaryNote":"Le corps doit être préparé par de belles pensées et des actes posés ; les corps et la vie des membres doivent aussi former un corps concret à l’église, à travers lequel l’Ange de la guérison puisse trouver un corps."}],"titleOnlyMatters":[]}