{"recordType":"documentary-extraction","protocolVersion":"1.5","source":{"recordId":"book-43-psalm-277","canonicalPath":"data/corpus/books/book-43/psalm-277.json","psalmNumber":277,"book":{"number":43,"title":"La guérison par les vertus"},"archangel":"raphael"},"extractionValidation":{"status":"draft"},"subjects":[{"localId":"subject-001","localSubject":"transmission véritable comme passage vivant du savoir par le subtil et l’invisible plutôt que par les seuls supports matériels","status":"EXPLOITÉ","verseNumbers":[1,2,3,4,5,6,7,8,9,10,20,24,25,26],"evidence":[{"verseNumbers":[7],"quote":"C’est toujours l’invisible qui transmet"}],"documentaryNote":"Écrit, parole, geste, éthers, atmosphères, esprits et matérialisation sont organisés autour de la distinction entre support visible et transmission subtile réelle."},{"localId":"subject-002","localSubject":"famille et environnement comme milieux subtils d’éducation qui imprègnent l’enfant et orientent son héritage avant les enseignements explicites","status":"EXPLOITÉ","verseNumbers":[6,7,11,12,13,14,24,25],"evidence":[{"verseNumbers":[6],"quote":"il capte les atmosphères, les énergies, les esprits."}],"documentaryNote":"Famille, village, hérédité et atmosphère ne sont pas atomisés ; ils composent le milieu effectif de transmission."},{"localId":"subject-003","localSubject":"incarnation personnelle du savoir comme condition pour transmettre une réalité vivante plutôt que le mensonge, la mort et la stérilité","status":"EXPLOITÉ","verseNumbers":[15,16,17,18,19,20,21,22,23,26,29,30],"evidence":[{"verseNumbers":[17],"quote":"Vous devez vous faire un corps avec le savoir reçu."}],"documentaryNote":"Vécu, vérité, vie intérieure et corps du savoir sont les critères coordonnés de transmissibilité ; le mensonge est leur conséquence contraire."},{"localId":"subject-004","localSubject":"organisation de la transmission essénienne comme responsabilité de préserver à travers les générations un futur vivant et harmonieux","status":"EXPLOITÉ","verseNumbers":[1,2,3,12,13,14,27,28,29,30],"evidence":[{"verseNumbers":[12],"quote":"mettre en place une organisation qui permettra de transmettre le savoir-faire essénien à travers les siècles."}],"documentaryNote":"Tradition, patrimoine, descendance et continuité de l’œuvre restent sous cette responsabilité collective ; seul ce qui est vivant mérite d’être légué."}],"titleOnlyMatters":[]}