{"recordType":"documentary-extraction","protocolVersion":"1.5","source":{"recordId":"book-41-psalm-291","canonicalPath":"data/corpus/books/book-41/psalm-291.json","psalmNumber":291,"book":{"number":41,"title":"La responsabilité d’un parent"},"archangel":"michael"},"extractionValidation":{"status":"draft"},"subjects":[{"localId":"subject-001","localSubject":"maturité parentale comme conscience responsable capable d’anticiper les conséquences et de guider au-delà des envies immédiates","status":"EXPLOITÉ","verseNumbers":[1,2,3,4,5,6,7,10,17,19,20,21,25,28],"evidence":[{"verseNumbers":[4],"quote":"Un parent est un sage, car il doit prendre soin de l’autre, il doit penser pour lui, le protéger et le guider."}],"documentaryNote":"Prévoyance, recul, prudence, analyse, continuité et évaluation des conséquences sont les modalités d’une même maturité responsable ; rêves et envies servent de contraste."},{"localId":"subject-002","localSubject":"gouvernement pour le Bien commun comme responsabilité exigeant sagesse, alliance avec Dieu et continuité de conscience","status":"EXPLOITÉ","verseNumbers":[1,6,8,9,18,19,20,22,24,26],"evidence":[{"verseNumbers":[8],"quote":"capables de gouverner pour le Bien commun"}],"documentaryNote":"Rois, dirigeants, autorité, Nation et responsabilité collective sont regroupés sous la fonction de gouvernement ; leur défaillance par impulsion ou ignorance en constitue l’échec."},{"localId":"subject-003","localSubject":"incarnation comme processus continu donnant un corps à une pensée, un être ou Dieu jusqu’à son accomplissement","status":"EXPLOITÉ","verseNumbers":[4,10,11,12,13,23,24,26],"evidence":[{"verseNumbers":[11],"quote":"Vivre sur la terre est un processus d’incarnation, ce qui signifie prendre un corps et donner un corps."}],"documentaryNote":"Étapes, moyens, chemin, enfant, famille, peuple, pensée, désir et divinité sont les applications d’un même processus d’incarnation, non des matières séparées."},{"localId":"subject-004","localSubject":"éducation vers l’état adulte comme libération de l’infantilisation et maîtrise consciente de la vie intérieure et extérieure","status":"EXPLOITÉ","verseNumbers":[15,16,17,19,20,21,22,26,28],"evidence":[{"verseNumbers":[17],"quote":"Un adulte est une individualité libre, responsable, claire"}],"documentaryNote":"Réflexion, analyse, méditation, discernement, tri, contrôle et maîtrise sont les capacités formées par cette éducation ; l’infantilisation est le mécanisme opposé."},{"localId":"subject-005","localSubject":"continuité immortelle et transmission du futur comme fil directeur de la responsabilité envers les générations à venir","status":"EXPLOITÉ","verseNumbers":[7,11,12,13,14,22,23,24,26,27,28],"evidence":[{"verseNumbers":[24],"quote":"Vous devez emmener avec vous les générations futures et l’humanité de demain."}],"documentaryNote":"Filiation, tradition, trame immortelle, semence du futur, Terre-Mère et transmission collective convergent vers une responsabilité de continuité dépassant l’instant."}],"titleOnlyMatters":[]}