{"recordType":"documentary-extraction","protocolVersion":"1.5","source":{"recordId":"book-36-psalm-230","canonicalPath":"data/corpus/books/book-36/psalm-230.json","psalmNumber":230,"book":{"number":36,"title":"Être un socle pour le monde divin"},"archangel":"ouriel"},"extractionValidation":{"status":"draft"},"subjects":[{"localId":"subject-001","localSubject":"cohésion universelle dans l’œuvre","status":"EXPLOITÉ","verseNumbers":[1,2,4,5,7,8,9,12,13,14,15,16,20],"evidence":[{"verseNumbers":[12],"quote":"Pour qu’une œuvre soit positive, bénéfique, il doit y avoir une cohésion universelle."}],"documentaryNote":"La réalisation juste exige que les parties, visions et règnes soient conduits dans une cohésion universelle plutôt que juxtaposés par une seule volonté humaine."},{"localId":"subject-002","localSubject":"harmonie avec tous les mondes","status":"EXPLOITÉ","verseNumbers":[2,4,5,7,13,14,16,20],"evidence":[{"verseNumbers":[4],"quote":"en harmonie avec tous les mondes"}],"documentaryNote":"L’homme doit inscrire son devenir et ses œuvres dans une harmonie qui inclut les mondes visibles et invisibles."},{"localId":"subject-003","localSubject":"élaboration du futur et œuvre du devenir","status":"EXPLOITÉ","verseNumbers":[3,4,9,14,20],"evidence":[{"verseNumbers":[3],"quote":"L’homme doit élaborer le futur, car il n’est pas, il devient."}],"documentaryNote":"L’œuvre humaine participe à l’élaboration du futur et doit être pensée comme un devenir cohérent pour toutes les parties concernées."},{"localId":"subject-004","localSubject":"plan complet et absence de parties manquantes","status":"EXPLOITÉ","verseNumbers":[8,9,11,13,14,20],"evidence":[{"verseNumbers":[9],"quote":"il ne peut y avoir de parties manquantes"}],"documentaryNote":"Une œuvre viable suppose un plan où fonctions, étapes, situations et réponses sont présentes et accordées."},{"localId":"subject-005","localSubject":"construction invisible avant manifestation visible","status":"EXPLOITÉ","verseNumbers":[10,11],"evidence":[{"verseNumbers":[11],"quote":"Un monde apparaît quand il est déjà construit, élaboré dans les mondes subtils."}],"documentaryNote":"La manifestation visible est précédée d’une construction et d’une alliance dans l’invisible ; commencer sans cette clarté expose l’œuvre à l’échec."},{"localId":"subject-006","localSubject":"richesse et pauvreté comme fruits de la cohérence","status":"EXPLOITÉ","verseNumbers":[12,13,14,20],"evidence":[{"verseNumbers":[13],"quote":"Si l’énergie, l’argent, le succès ne sont pas toujours présents"}],"documentaryNote":"Énergie, moyens, croissance et richesse sont reliés à la cohérence de l’œuvre, tandis que l’incohérence engendre pauvreté et dépérissement."},{"localId":"subject-007","localSubject":"sainte assemblée humaine et universelle","status":"EXPLOITÉ","verseNumbers":[16],"evidence":[{"verseNumbers":[16],"quote":"Il en est de même dans la sainte assemblée universelle"}],"documentaryNote":"L’assemblée humaine est mise en correspondance avec une assemblée universelle où Dieux, Archanges, Anges, hommes, animaux, végétaux et pierres ont chacun leur place."},{"localId":"subject-008","localSubject":"juste place de chaque vision","status":"EXPLOITÉ","verseNumbers":[13,14,15,16,17,18],"evidence":[{"verseNumbers":[15],"quote":"chaque vision soit apportée et mise à sa juste place"}],"documentaryNote":"Aucun être ni aucun monde ne porte seul la totalité ; la cohésion naît de l’apport de chaque vision à sa juste place."},{"localId":"subject-009","localSubject":"connaissance et maîtrise liées au corps","status":"EXPLOITÉ","verseNumbers":[17,18,19,20],"evidence":[{"verseNumbers":[19],"quote":"La connaissance et la maîtrise sont liées au corps."}],"documentaryNote":"Le texte limite la parole compétente à ce dont un être a réellement le corps, la connaissance et la maîtrise."},{"localId":"subject-010","localSubject":"dialogue universel entre les mondes","status":"EXPLOITÉ","verseNumbers":[15,16,20],"evidence":[{"verseNumbers":[20],"quote":"une bonne entente et un dialogue universel entre tous les mondes"}],"documentaryNote":"Le dialogue universel permet de comprendre la part de chaque règne et d’élaborer une œuvre où chaque hiérarchie trouve existence et bénéfice."}],"titleOnlyMatters":[]}