{"recordType":"documentary-extraction","protocolVersion":"1.5","source":{"recordId":"book-32-psalm-187","canonicalPath":"data/corpus/books/book-32/psalm-187.json","psalmNumber":187,"book":{"number":32,"title":"La Nouvelle Alliance"},"archangel":"ouriel"},"extractionValidation":{"status":"draft"},"subjects":[{"localId":"subject-001","localSubject":"tête","status":"EXPLOITÉ","verseNumbers":[1],"evidence":[{"verseNumbers":[1],"quote":"Cette tête constitue le gouvernement central qui fait fonctionner tout l’organisme de l’homme."}],"documentaryNote":"La tête est décrite comme centre de gouvernement et de commandement du corps."},{"localId":"subject-002","localSubject":"intellect","status":"EXPLOITÉ","verseNumbers":[2],"evidence":[{"verseNumbers":[2],"quote":"le centre de la tête, l’intellect, a tellement été perfectionné qu’il gouverne même la subtilité"}],"documentaryNote":"L’intellect a pris une place dominante qui peut étouffer les autres formes de perception et l’âme."},{"localId":"subject-003","localSubject":"subtilité","status":"EXPLOITÉ","verseNumbers":[3],"evidence":[{"verseNumbers":[3],"quote":"la subtilité était dirigée par des centres qui appartenaient à la Mère"}],"documentaryNote":"La subtilité était reliée à des centres de perception orientés vers l’âme, la finesse et le monde magique."},{"localId":"subject-004","localSubject":"Mère","status":"EXPLOITÉ","verseNumbers":[3],"evidence":[{"verseNumbers":[3],"quote":"des centres qui appartenaient à la Mère et qui étaient en relation avec Elle."}],"documentaryNote":"La Mère est reliée aux centres subtils qui ouvraient l’homme à une vie supérieure."},{"localId":"subject-005","localSubject":"centres de perception","status":"EXPLOITÉ","verseNumbers":[4],"evidence":[{"verseNumbers":[4],"quote":"laissant à l’abandon les autres centres de perception."}],"documentaryNote":"Les centres de perception autres que l’intellect ont été abandonnés et doivent retrouver leur place."},{"localId":"subject-006","localSubject":"perception animiste","status":"EXPLOITÉ","verseNumbers":[4],"evidence":[{"verseNumbers":[4],"quote":"au détriment de la perception animiste, magique, féérique de la vie."}],"documentaryNote":"La perception animiste et magique de la vie est affaiblie par l’intellectualisation."},{"localId":"subject-007","localSubject":"monde","status":"EXPLOITÉ","verseNumbers":[5],"evidence":[{"verseNumbers":[5],"quote":"Le monde est devenu malade de la perception de l’homme"}],"documentaryNote":"Le monde est affecté par la manière dont l’homme perçoit, conçoit et considère la vie."},{"localId":"subject-008","localSubject":"nature","status":"EXPLOITÉ","verseNumbers":[6],"evidence":[{"verseNumbers":[6],"quote":"L’homme dit que la nature est une merveille"}],"documentaryNote":"La nature doit être approchée sans domination ni séparation, comme source d’enseignement."},{"localId":"subject-009","localSubject":"Dieu","status":"EXPLOITÉ","verseNumbers":[7],"evidence":[{"verseNumbers":[7],"quote":"Si Dieu décide d’enlever à l’homme son intellect"}],"documentaryNote":"Dieu est la référence qui permet de juger et réorienter l’intelligence de l’homme vers la vie."},{"localId":"subject-010","localSubject":"âme","status":"EXPLOITÉ","verseNumbers":[9],"evidence":[{"verseNumbers":[9],"quote":"il est aussi une âme et une intelligence immortelles."}],"documentaryNote":"L’homme est aussi une âme immortelle qui doit redevenir le centre de sa vie."},{"localId":"subject-011","localSubject":"intelligence immortelle","status":"EXPLOITÉ","verseNumbers":[9],"evidence":[{"verseNumbers":[9],"quote":"une âme et une intelligence immortelles."}],"documentaryNote":"Une intelligence immortelle appartient à l’homme au-delà du seul intellect mortel."},{"localId":"subject-012","localSubject":"concepts morts","status":"EXPLOITÉ","verseNumbers":[10],"evidence":[{"verseNumbers":[10],"quote":"enfermer les mondes dans des concepts morts."}],"documentaryNote":"Les concepts morts enferment les mondes et empêchent la communication vivante avec les êtres."},{"localId":"subject-013","localSubject":"harmonie des intelligences","status":"EXPLOITÉ","verseNumbers":[11],"evidence":[{"verseNumbers":[11],"quote":"il doit être en harmonie avec les autres centres d’intelligence"}],"documentaryNote":"L’intellect n’est juste que s’il demeure en harmonie avec les autres centres d’intelligence."},{"localId":"subject-014","localSubject":"éducation","status":"EXPLOITÉ","verseNumbers":[14],"evidence":[{"verseNumbers":[14],"quote":"L’homme doit se remettre en question et choisir une autre éducation."}],"documentaryNote":"Une autre éducation est nécessaire pour que la compréhension spirituelle transforme réellement la vie."},{"localId":"subject-015","localSubject":"transformation","status":"EXPLOITÉ","verseNumbers":[17],"evidence":[{"verseNumbers":[17],"quote":"il doit réellement se transformer, se corriger, s’éduquer pour redevenir une âme."}],"documentaryNote":"La transformation doit corriger le mode de fonctionnement de l’homme pour qu’il redevienne une âme."},{"localId":"subject-016","localSubject":"Lumière","status":"EXPLOITÉ","verseNumbers":[19],"evidence":[{"verseNumbers":[19],"quote":"S’il se présente devant la Lumière"}],"documentaryNote":"La Lumière doit être servie et non utilisée pour nourrir un monde opposé."},{"localId":"subject-017","localSubject":"sagesse","status":"EXPLOITÉ","verseNumbers":[19],"evidence":[{"verseNumbers":[19],"quote":"Il étudie la sagesse pour devenir un sage"}],"documentaryNote":"La sagesse doit être honorée et libérée pour éclairer le monde, non appropriée par l’homme."},{"localId":"subject-018","localSubject":"ignorance","status":"EXPLOITÉ","verseNumbers":[25],"evidence":[{"verseNumbers":[25],"quote":"Pensez que vous êtes avant tout des ignorants"}],"documentaryNote":"La conscience de l’ignorance doit conduire à l’humilité dans l’action."},{"localId":"subject-019","localSubject":"humilité","status":"EXPLOITÉ","verseNumbers":[25],"evidence":[{"verseNumbers":[25],"quote":"lorsque vous accomplissez une œuvre, ce soit toujours avec humilité."}],"documentaryNote":"L’humilité doit accompagner toute œuvre et fonde l’attitude du rite d’expiation."},{"localId":"subject-020","localSubject":"rite d’expiation","status":"EXPLOITÉ","verseNumbers":[26],"evidence":[{"verseNumbers":[26],"quote":"l’idée principale du rite d’expiation est d’apprendre à être humble"}],"documentaryNote":"Le rite d’expiation apprend l’humilité et l’excuse envers les mondes inconnus offensés par l’inconscience."},{"localId":"subject-021","localSubject":"Nation Essénienne","status":"EXPLOITÉ","verseNumbers":[26],"evidence":[{"verseNumbers":[26],"quote":"l’éveil viendra dans la Nation Essénienne"}],"documentaryNote":"La Nation Essénienne doit accueillir un éveil capable de transformer le mode de fonctionnement humain."},{"localId":"subject-022","localSubject":"puissance divine","status":"EXPLOITÉ","verseNumbers":[27],"evidence":[{"verseNumbers":[27],"quote":"en détournant la puissance divine."}],"documentaryNote":"La puissance divine ne doit pas être asservie aux intérêts mortels ni détournée de sa finalité."},{"localId":"subject-023","localSubject":"volonté de la Lumière","status":"EXPLOITÉ","verseNumbers":[28],"evidence":[{"verseNumbers":[28],"quote":"L’homme décide, mais il ne laisse pas la Lumière parler et proclamer sa volonté."}],"documentaryNote":"L’homme doit laisser la Lumière parler et proclamer sa volonté plutôt que tout imposer par son propre intellect."},{"localId":"subject-024","localSubject":"éveil","status":"EXPLOITÉ","verseNumbers":[23],"evidence":[{"verseNumbers":[23],"quote":"Éveillez‑vous maintenant."}],"documentaryNote":"L’éveil doit avoir lieu maintenant, avant que l’épreuve ne force l’homme à se remettre en question."},{"localId":"subject-025","localSubject":"corps vivant","status":"EXPLOITÉ","verseNumbers":[22],"evidence":[{"verseNumbers":[22],"quote":"sans faire apparaître un corps vivant"}],"documentaryNote":"Les paroles spirituelles doivent faire apparaître un corps vivant plutôt que rester lettre morte."}],"titleOnlyMatters":[]}