{"recordType":"documentary-extraction","protocolVersion":"1.5","source":{"recordId":"book-38-psalm-248","canonicalPath":"data/corpus/books/book-38/psalm-248.json","psalmNumber":248,"book":{"number":38,"title":"Les 22 étapes de l’Initiation"},"archangel":"gabriel"},"extractionValidation":{"status":"draft"},"subjects":[{"localId":"subject-001","localSubject":"orgueil comme force d’apparition à maîtriser et équilibrer","status":"EXPLOITÉ","verseNumbers":[1,3,4,5,8,9,13,15,17,19,20,23,24,26,27,30],"evidence":[{"verseNumbers":[15],"quote":"L’orgueil est la force qui te permet d’apparaître"}],"documentaryNote":"Le canon ne présente pas l’orgueil comme simplement négatif : il est force d’apparition et de dignité lorsqu’il reste mesuré, mais devient séparation lorsqu’il franchit la limite."},{"localId":"subject-002","localSubject":"séparation de Dieu, usurpation et monde des apparences","status":"EXPLOITÉ","verseNumbers":[2,3,6,7,9,10,12,13,14,18,20,24,25,27,28,31,33],"evidence":[{"verseNumbers":[10],"quote":"le principe de l’usurpation"}],"documentaryNote":"Vanité, semblant, fausse image, suprématie et culte de soi sont regroupés comme manifestations de l’orgueil séparé de la source."},{"localId":"subject-003","localSubject":"équilibre entre manifestation visible et grand invisible","status":"EXPLOITÉ","verseNumbers":[13,16,17,18,19,21,22,23,24,26,27,28,29,30,32],"evidence":[{"verseNumbers":[26],"quote":"la limite entre le visible et l’invisible"}],"documentaryNote":"Parole/silence, apparition/effacement, personnalité/âme sont des couples illustrant un même équilibre entre manifestation et non-manifesté, non des sujets indépendants."},{"localId":"subject-004","localSubject":"homme comme instrument de manifestation de Dieu","status":"EXPLOITÉ","verseNumbers":[17,19,20,21,22,28,29,30,31,32,33],"evidence":[{"verseNumbers":[21],"quote":"tu es juste un instrument qui doit travailler sur toi pour Le manifester"}],"documentaryNote":"La manifestation juste ne glorifie pas l’aspect mortel : elle laisse apparaître la grandeur divine à travers l’instrument humain."},{"localId":"subject-005","localSubject":"juste estimation de soi entre effacement et surestimation","status":"EXPLOITÉ","verseNumbers":[7,19,20,23,26,30,31,33],"evidence":[{"verseNumbers":[23],"quote":"qu’il n’y ait pas de sous-estimation de soi [...] pas non plus [...] de surestimation"}],"documentaryNote":"Cette juste mesure possède une autonomie pratique propre : elle évite à la fois l’effacement et l’illusion de grandeur sans supprimer la capacité d’apparaître."}],"titleOnlyMatters":[]}