{"recordType":"documentary-extraction","protocolVersion":"1.5","source":{"recordId":"book-40-psalm-242","canonicalPath":"data/corpus/books/book-40/psalm-242.json","psalmNumber":242,"book":{"number":40,"title":"L’Ange de la conscience"},"archangel":"ouriel"},"extractionValidation":{"status":"draft"},"subjects":[{"localId":"subject-001","localSubject":"mort physique comme passage et renouvellement dans le cycle continu de l’âme","status":"EXPLOITÉ","verseNumbers":[1,2,3,4,5,6,11,12,13,23,24],"evidence":[{"verseNumbers":[6],"quote":"tant qu’il y a le cycle de l’incarnation, l’âme évolue et qu’il n’y a donc jamais d’arrêt"}],"documentaryNote":"Sommeil, renouvellement cellulaire, perte du corps et passage du voile sont les modalités de la mort physique dans une continuité de l’âme."},{"localId":"subject-002","localSubject":"mort intérieure comme blocage de l’évolution et extinction de la lumière créatrice","status":"EXPLOITÉ","verseNumbers":[7,8,9,10,11,28,38],"evidence":[{"verseNumbers":[10],"quote":"La mort, c’est ne plus pouvoir évoluer, être bloqué"}],"documentaryNote":"Enfermement, répétition, atrophie de pensée-sentiment-volonté, esclavage et stagnation constituent le mécanisme autonome de mort déjà actif dans la vie."},{"localId":"subject-003","localSubject":"conscience, Ange et âme immortelle comme même être de guidance et de libération","status":"EXPLOITÉ","verseNumbers":[14,15,18,19,23,27,29,30,33,34,36,37],"evidence":[{"verseNumbers":[30],"quote":"c’est le même être dans des sphères d’existence différentes"}],"documentaryNote":"Le canon fusionne explicitement conscience, Ange et âme immortelle ; ils ne sont donc pas séparés artificiellement en trois matières."},{"localId":"subject-004","localSubject":"éveil de la conscience comme ouverture d’une vision supérieure transformant la vie","status":"EXPLOITÉ","verseNumbers":[13,14,15,16,17,27,29,31,32,36,37,38,39,40,41,42],"evidence":[{"verseNumbers":[40],"quote":"La conscience n’est jamais abstraite, elle amène toujours une transformation intégrale et une réalisation concrète."}],"documentaryNote":"Clarté, évidence, vision, lucidité, énergie, changement et réalisation sont les effets d’un même éveil, distinct d’une compréhension seulement intellectuelle."},{"localId":"subject-005","localSubject":"Ronde, culte de la Lumière et pratiques sacrées comme moyens d’attirer et fixer la conscience","status":"EXPLOITÉ","verseNumbers":[17,18,19,20,21,22,26,31,35,41],"evidence":[{"verseNumbers":[20],"quote":"ne sont que des moyens d’éveiller la concentration, de la fixer pour faire apparaître la conscience"}],"documentaryNote":"Étude, méditation, rituels, dévotion, statue, adoration et organisation sont explicitement présentés comme moyens et ne sont pas transformés en finalités autonomes."},{"localId":"subject-006","localSubject":"conscience comme véhicule de continuité, mémoire et discernement au-delà du corps","status":"EXPLOITÉ","verseNumbers":[13,23,24,25,26,27,29,30,33],"evidence":[{"verseNumbers":[23],"quote":"La conscience, c’est votre véhicule."}],"documentaryNote":"Après la mort, ouverture des portes, mémoire, reconnaissance des liens et distinction entre ce qui appartient à l’être et les influences constituent une fonction propre de la conscience."}],"titleOnlyMatters":[]}