{"recordType":"documentary-extraction","protocolVersion":"1.5","source":{"recordId":"book-32-psalm-185","canonicalPath":"data/corpus/books/book-32/psalm-185.json","psalmNumber":185,"book":{"number":32,"title":"La Nouvelle Alliance"},"archangel":"ouriel"},"extractionValidation":{"status":"draft"},"subjects":[{"localId":"subject-001","localSubject":"chemin et mission","status":"EXPLOITÉ","verseNumbers":[1],"evidence":[{"verseNumbers":[1],"quote":"Chaque homme qui prend un corps sur la terre est porteur d’un chemin et d’une mission."}],"documentaryNote":"Chaque homme porte un chemin et une mission propres, avec des forces, faiblesses et aptitudes différentes."},{"localId":"subject-002","localSubject":"différences","status":"EXPLOITÉ","verseNumbers":[2],"evidence":[{"verseNumbers":[2],"quote":"les chemins, les moyens seront nécessairement différents pour chacun."}],"documentaryNote":"Les différences entre les êtres doivent être unies dans un but commun sans être supprimées."},{"localId":"subject-003","localSubject":"vérité","status":"EXPLOITÉ","verseNumbers":[2],"evidence":[{"verseNumbers":[2],"quote":"Une seule vérité peut unir les hommes : celle du but à atteindre et des fondements sur lesquels chacun est posé."}],"documentaryNote":"La vérité qui unit porte sur le but commun et les fondements, non sur l’uniformité des chemins."},{"localId":"subject-004","localSubject":"corps de Dieu","status":"EXPLOITÉ","verseNumbers":[2],"evidence":[{"verseNumbers":[2],"quote":"vouloir créer un corps à Dieu sur la terre est un but qui peut unifier tous les êtres."}],"documentaryNote":"Le corps de Dieu sur la terre est un but commun qui doit être rendu clair, organisé et accessible."},{"localId":"subject-005","localSubject":"volonté de Dieu","status":"EXPLOITÉ","verseNumbers":[3],"evidence":[{"verseNumbers":[3],"quote":"C’est la volonté de Dieu que les hommes unissent leurs différences"}],"documentaryNote":"La volonté de Dieu est que les hommes unissent leurs différences pour faire apparaître sa maison."},{"localId":"subject-006","localSubject":"maison de Dieu","status":"EXPLOITÉ","verseNumbers":[3],"evidence":[{"verseNumbers":[3],"quote":"faire apparaître la maison de Dieu sur la terre"}],"documentaryNote":"La maison de Dieu doit apparaître sur la terre et constituer un monde, une culture et un art de vivre."},{"localId":"subject-007","localSubject":"Nation Essénienne","status":"EXPLOITÉ","verseNumbers":[3],"evidence":[{"verseNumbers":[3],"quote":"à travers la Nation Essénienne et son église."}],"documentaryNote":"La Nation Essénienne participe à l’apparition de la maison et du corps de Dieu."},{"localId":"subject-008","localSubject":"Église Essénienne","status":"EXPLOITÉ","verseNumbers":[7],"evidence":[{"verseNumbers":[7],"quote":"l’instauration de l’Église Essénienne."}],"documentaryNote":"L’Église Essénienne doit être instaurée comme organisation concrète du corps de Dieu."},{"localId":"subject-009","localSubject":"civilisation","status":"EXPLOITÉ","verseNumbers":[4],"evidence":[{"verseNumbers":[4],"quote":"La maison de Dieu est un monde à part entière, une civilisation, une culture, une religion, un art de vivre"}],"documentaryNote":"La maison de Dieu porte une civilisation qui permet de grandir et cheminer vers le monde divin."},{"localId":"subject-010","localSubject":"monde divin","status":"EXPLOITÉ","verseNumbers":[4],"evidence":[{"verseNumbers":[4],"quote":"cheminer vers le monde divin."}],"documentaryNote":"Le monde divin est la direction vers laquelle conduit l’art de vivre de la maison de Dieu."},{"localId":"subject-011","localSubject":"royaume de Dieu","status":"EXPLOITÉ","verseNumbers":[5],"evidence":[{"verseNumbers":[5],"quote":"Si tu crois aux valeurs du royaume de Dieu"}],"documentaryNote":"Les valeurs du royaume de Dieu doivent entrer dans la vie et orienter l’association avec ceux qui œuvrent pour elles."},{"localId":"subject-012","localSubject":"immortel en l’homme","status":"EXPLOITÉ","verseNumbers":[6],"evidence":[{"verseNumbers":[6],"quote":"il doit aussi éveiller en lui ce qui est immortel, impersonnel"}],"documentaryNote":"L’homme doit éveiller en lui ce qui est immortel et impersonnel plutôt que d’agir seulement pour des intérêts mortels."},{"localId":"subject-013","localSubject":"organisation","status":"EXPLOITÉ","verseNumbers":[7],"evidence":[{"verseNumbers":[7],"quote":"à travers une organisation bien pensée"}],"documentaryNote":"L’organisation du corps de Dieu doit être pensée, structurée et définie jusque dans ses fonctions et moyens."},{"localId":"subject-014","localSubject":"œuvre commune","status":"EXPLOITÉ","verseNumbers":[10],"evidence":[{"verseNumbers":[10],"quote":"Définissez la perfection de l’œuvre commune"}],"documentaryNote":"L’œuvre commune doit être définie dans sa perfection afin d’ouvrir un chantier auquel les individus peuvent contribuer."},{"localId":"subject-015","localSubject":"fraternité","status":"EXPLOITÉ","verseNumbers":[10],"evidence":[{"verseNumbers":[10],"quote":"C’est cela la fraternité, le Bien commun"}],"documentaryNote":"La fraternité naît de l’union des différences au service d’une œuvre commune."},{"localId":"subject-016","localSubject":"Bien commun","status":"EXPLOITÉ","verseNumbers":[10],"evidence":[{"verseNumbers":[10],"quote":"la fraternité, le Bien commun"}],"documentaryNote":"Le Bien commun doit inspirer l’œuvre et ouvrir un chemin positif et libérateur."},{"localId":"subject-017","localSubject":"structure et fonctions","status":"EXPLOITÉ","verseNumbers":[12],"evidence":[{"verseNumbers":[12],"quote":"doit être définie dans sa structure, son organisation, ses fonctions et ses moyens d’action."}],"documentaryNote":"L’œuvre doit être définie concrètement dans sa structure, ses fonctions et ses moyens d’action."},{"localId":"subject-018","localSubject":"aboutissement","status":"EXPLOITÉ","verseNumbers":[13],"evidence":[{"verseNumbers":[13],"quote":"Tout ce que vous initiez doit être conduit jusqu’à l’aboutissement."}],"documentaryNote":"Tout travail entrepris doit être conduit jusqu’à son aboutissement."},{"localId":"subject-019","localSubject":"vision d’ensemble","status":"EXPLOITÉ","verseNumbers":[15],"evidence":[{"verseNumbers":[15],"quote":"intégrer tous les aspects de l’œuvre dans l’intelligence et la vision d’ensemble."}],"documentaryNote":"La vision d’ensemble doit intégrer les différents aspects de l’œuvre plutôt que disperser l’action."},{"localId":"subject-020","localSubject":"salut","status":"EXPLOITÉ","verseNumbers":[17],"evidence":[{"verseNumbers":[17],"quote":"tous les hommes puissent trouver un chemin de salut et d’action positive, libératrice."}],"documentaryNote":"L’œuvre doit offrir aux hommes un chemin de salut et d’action libératrice."},{"localId":"subject-021","localSubject":"futur","status":"EXPLOITÉ","verseNumbers":[18],"evidence":[{"verseNumbers":[18],"quote":"vous êtes les pionniers qui préparent le futur."}],"documentaryNote":"Les pionniers de l’œuvre préparent le futur par leur action présente."},{"localId":"subject-022","localSubject":"inspiration","status":"EXPLOITÉ","verseNumbers":[21],"evidence":[{"verseNumbers":[21],"quote":"Trouvez votre inspiration auprès de Dieu, de son intelligence"}],"documentaryNote":"L’inspiration doit être cherchée auprès de Dieu plutôt que dans l’intelligence du monde de l’homme."},{"localId":"subject-023","localSubject":"confiance en Dieu","status":"EXPLOITÉ","verseNumbers":[22],"evidence":[{"verseNumbers":[22],"quote":"Ne placez pas votre confiance dans le monde de l’homme, mais en Dieu."}],"documentaryNote":"La confiance doit être placée en Dieu et non dans le monde de l’homme."},{"localId":"subject-024","localSubject":"souveraineté de Dieu","status":"EXPLOITÉ","verseNumbers":[23],"evidence":[{"verseNumbers":[23],"quote":"Dieu seul est le souverain"}],"documentaryNote":"Dieu seul est le souverain auquel gloire et victoire doivent être offertes."},{"localId":"subject-025","localSubject":"service de Dieu","status":"EXPLOITÉ","verseNumbers":[25],"evidence":[{"verseNumbers":[25],"quote":"Si vous participez à l’œuvre du corps de Dieu dans le service et la pureté"}],"documentaryNote":"Le service de Dieu dans la pureté inscrit l’œuvre jusque dans le plan physique."},{"localId":"subject-026","localSubject":"hommes et femmes de Dieu","status":"EXPLOITÉ","verseNumbers":[27],"evidence":[{"verseNumbers":[27],"quote":"devenez des hommes et des femmes de Dieu"}],"documentaryNote":"L’homme doit devenir homme ou femme de Dieu pour comprendre et réaliser ce qui est demandé."},{"localId":"subject-027","localSubject":"éducation","status":"EXPLOITÉ","verseNumbers":[28],"evidence":[{"verseNumbers":[28],"quote":"il doit accepter d’être éduqué"}],"documentaryNote":"L’éducation est nécessaire lorsque l’homme doit dépasser ce qu’il sait déjà faire et laisser apparaître un nouveau corps de pensée et d’action."},{"localId":"subject-028","localSubject":"religion essénienne","status":"EXPLOITÉ","verseNumbers":[30],"evidence":[{"verseNumbers":[30],"quote":"la nouvelle religion essénienne deviendra la religion éternelle et immortelle"}],"documentaryNote":"La religion essénienne est appelée à devenir une religion éternelle ouvrant un nouveau chemin pour l’humanité."},{"localId":"subject-029","localSubject":"Alliance","status":"EXPLOITÉ","verseNumbers":[31],"evidence":[{"verseNumbers":[31],"quote":"Le monde divin est avec vous dans l’Alliance"}],"documentaryNote":"L’Alliance rend présent le monde divin mais laisse à l’homme sa part d’action à comprendre et accomplir."}],"titleOnlyMatters":[]}